A1: 1-4 主要年份云南国民经济主要指标总量和增长速度 | G1: Growth Rate and Total Amounts of Principal Indicators on National
G2: Economy in Significant Years of Yunnan
A4: 指 标 | B4: Item | C4: 总 量 指 标 | G4: Aggregate Data | J4: 各年比上年增长(±%) | O4: 年平均增长速度(%)
J5: Growth Rate over Last Year | N5: Average Annual Growth Rate(%)
C6: 1978 | D6: 1990 | G6: 2000 | H6: 2010 | I6: 2015 | J6: 1990 | K6: 2000 | L6: 2010 | M6: 2015 | N6: 1979-2015 | O6: 1991-2015 | P6: 2001-2015 | Q6: 2011-2015
A8: 生产总值(GDP)(亿元) | B8: Gross Regional Product of Yunnan Province | C8: 69.05 | D8: 451.67 | G8: 2011.19 | H8: 7224.18 | I8: 13619.17 | J8: 8.6999999999999993 | K8: 7.5 | L8: 12.30 | M8: 8.6999999999999993 | N8: 10.05044011278622 | O8: 10.197397922407149 | P8: 10.595449559196979 | Q8: 11.096344522371116
A9: 年末总人口(万人) | B9: Total Population at Year-end (10 000 persons) | C9: 3091.5 | D9: 3730.60 | G9: 4240.80 | H9: 4601.6000000000004 | I9: 4741.80 | J9: 2.2599999999999998 | K9: 1.1544699933212721 | L9: 0.70 | M9: 0.60 | N9: =((I9/C9)^(1/(2015-1978))-1)*100 -> 1.1628179613250911 | O9: =((I9/D9)^(1/(2015-1990))-1)*100 -> 0.96400783499044351 | P9: =((I9/G9)^(1/(2015-2000))-1)*100 -> 0.74721031938103089 | Q9: =((I9/H9)^(1/(2015-2010))-1)*100 -> 0.60205996633770908
A10: 全社会固定资产投资总额(亿元) | B10: Total Investment in Fixed Assets (100 million yuan) | C10: 15.04 | D10: 75.739999999999995 | G10: 697.94 | H10: 5528.71 | I10: 13500.62 | J10: 11.710914454277276 | K10: -2.6962971224626209 | L10: 22.10 | M10: 17.411193000000001 | N10: 23.5 | O10: 20.100000000000001 | P10: 22.10 | Q10: 19.70
A11: 社会消费品零售总额(亿元) | B11: Total Retail Sales of Consumer Goods (100 million yuan) | C11: 28.38 | D11: 145.59 | G11: 583.16999999999996 | H11: 2555.8000000000002 | I11: 5103.1508000000003 | J11: 2.4175292325051556 | K11: 8.2047222880909487 | L11: 24.5 | M11: 10.151022475089665 | N11: =((I11/C11)^(1/(2015-1978))-1)*100 -> 15.064470567755306 | O11: =((I11/D11)^(1/(2015-1990))-1)*100 -> 15.28910672901076 | P11: =((I11/G11)^(1/(2015-2000))-1)*100 -> 15.558762348861709 | Q11: =((I11/H11)^(1/(2015-2010))-1)*100 -> 14.831835634162726
A12: 进出口总额(亿美元) | B12: Total Value of Exports and Imports (USD 10 000) | C12: 1.04 | D12: 5.4842000000000004 | G12: 18.128299999999999 | H12: 133.68 | I12: 245.27 | J12: 0.13511539585160381 | K12: 9.2283405737285218 | L12: 66.70 | M12: -17.200054013908588 | N12: =((I12/C12)^(1/(2015-1978))-1)*100 -> 15.91099238382081 | O12: =((I12/D12)^(1/(2015-1990))-1)*100 -> 16.418298033102687 | P12: =((I12/G12)^(1/(2015-2000))-1)*100 -> 18.964985709898198 | Q12: =((I12/H12)^(1/(2015-2010))-1)*100 -> 12.905630111921074
A13: 出口额 | B13: Export Value | C13: 0.69 | D13: 4.34 | G13: 11.7516 | H13: 76.06 | I13: 166.26 | J13: 16 | K13: 13.604593834285538 | L13: 68.5 | M13: -11.573236889692595 | N13: =((I13/C13)^(1/(2015-1978))-1)*100 -> 15.978295358756389 | O13: =((I13/D13)^(1/(2015-1990))-1)*100 -> 15.699617147954935 | P13: =((I13/G13)^(1/(2015-2000))-1)*100 -> 19.319855397718722 | Q13: =((I13/H13)^(1/(2015-2010))-1)*100 -> 16.930091901921472
A14: 进口额 | B14: Import Value | C14: 0.35 | D14: 1.1393 | G14: 6.3766999999999996 | H14: 57.62 | I14: 79.010000000000005 | J14: -34.243333718111501 | K14: 1.9880365939479283 | L14: 64.400000000000006 | M14: -26.977818853974117 | N14: =((I14/C14)^(1/(2015-1978))-1)*100 -> 15.774040308143977 | O14: =((I14/D14)^(1/(2015-1990))-1)*100 -> 18.479103293325537 | P14: =((I14/G14)^(1/(2015-2000))-1)*100 -> 18.269403135777338 | Q14: =((I14/H14)^(1/(2015-2010))-1)*100 -> 6.5176954069980697
A15: 财 政 (亿元) | B15: Government Finance (100 million yuan)
A16: 财政总收入 | B16: Government Revenue | C16: 11.76 | D16: 77.430000000000007 | G16: 432.95 | H16: 1809.20 | I16: 3250.02 | J16: 22.380275011853957 | K16: 1.7676233457913027 | L16: 21.40 | M16: 3 | N16: =((I16/C16)^(1/(2015-1978))-1)*100 -> 16.408826481784256 | O16: =((I16/D16)^(1/(2015-1990))-1)*100 -> 16.123220273083973 | P16: =((I16/G16)^(1/(2015-2000))-1)*100 -> 14.383457330886017 | Q16: =((I16/H16)^(1/(2015-2010))-1)*100 -> 12.429399460793533
A17: 财政支出 | B17: Government Expenditure | C17: 18.28 | D17: 90.76 | G17: 414.11 | H17: 2285.7199999999998 | I17: 4712.83 | J17: 10.834310277452119 | K17: 9.5384208438037419 | L17: 17.100000000000001 | M17: 6.1931329118202507 | N17: =((I17/C17)^(1/(2015-1978))-1)*100 -> 16.190446641990739 | O17: =((I17/D17)^(1/(2015-1990))-1)*100 -> 17.11580057510411 | P17: =((I17/G17)^(1/(2015-2000))-1)*100 -> 17.6010150857695 | Q17: =((I17/H17)^(1/(2015-2010))-1)*100 -> 15.571765892348367
A18: 主要农产品产量(万吨) | B18: Output of Major Agriculture Products(10 000 tons)
A19: 粮 食 | B19: Grain | C19: 864.05 | D19: 1061.21 | G19: 1467.80 | H19: 1650 | I19: 1969.79 | J19: 6.2900011017517965 | K19: 4.899053064141512 | L19: 4.6343505060497625 | M19: 1.4925279005911025 | N19: =((I19/C19)^(1/(2015-1978))-1)*100 -> 2.2521529350405745 | O19: =((I19/D19)^(1/(2015-1990))-1)*100 -> 2.5049277312961582 | P19: =((I19/G19)^(1/(2015-2000))-1)*100 -> 1.980437239306565 | Q19: =((I19/H19)^(1/(2015-2010))-1)*100 -> 3.6065462968062567
A20: 油 料 | C20: 5.51 | D20: 13.31 | G20: 26.98 | H20: 34.229999999999997 | I20: 65.92 | J20: 21.886446886446898 | K20: 30.843840931134814 | L20: -31.80 | M20: 1.912576880841288 | N20: =((I20/C20)^(1/(2015-1978))-1)*100 -> 6.9378633940591738 | O20: =((I20/D20)^(1/(2015-1990))-1)*100 -> 6.6089253929779712 | P20: =((I20/G20)^(1/(2015-2000))-1)*100 -> 6.1365622776370143 | Q20: =((I20/H20)^(1/(2015-2010))-1)*100 -> 14.00451724891354
A21: 甘 蔗 | B21: Sugarcane | C21: 160.01 | D21: 661.88 | G21: 1420.29 | H21: 1750.92 | I21: 1930.05 | J21: 20.062400232186906 | K21: -6.9595749837867533 | L21: -0.60 | M21: -8.545773313116003 | N21: =((I21/C21)^(1/(2015-1978))-1)*100 -> 6.9615299529387498 | O21: =((I21/D21)^(1/(2015-1990))-1)*100 -> 4.3738184320148976 | P21: =((I21/G21)^(1/(2015-2000))-1)*100 -> 2.0656099738416644 | Q21: =((I21/H21)^(1/(2015-2010))-1)*100 -> 1.9671900166554845
A22: 烤 烟 | B22: Flue-cured Tobacco | C22: 12.26 | D22: 43.60 | G22: 64.61 | H22: 95.40 | I22: 90.34 | J22: -4.5325158747536731 | K22: 6.0049220672682369 | L22: 8.40 | M22: -4.4021164021163983 | N22: =((I22/C22)^(1/(2015-1978))-1)*100 -> 5.5462876503807879 | O22: =((I22/D22)^(1/(2015-1990))-1)*100 -> 2.9569678618459383 | P22: =((I22/G22)^(1/(2015-2000))-1)*100 -> 2.2598982697570991 | Q22: =((I22/H22)^(1/(2015-2010))-1)*100 -> -1.084046369490943
A23: 水 果 | B23: Fruits | C23: 11.62 | D23: 31.97 | G23: 76.95 | H23: 397.91 | I23: 726.54 | J23: 50.90 | K23: 4.2259244209670976 | L23: 16.100000000000001 | M23: 8.5976499999999998 | N23: =((I23/C23)^(1/(2015-1978))-1)*100 -> 11.825792283929658 | O23: =((I23/D23)^(1/(2015-1990))-1)*100 -> 13.308026573118138 | P23: =((I23/G23)^(1/(2015-2000))-1)*100 -> 16.145768974810792 | Q23: =((I23/H23)^(1/(2015-2010))-1)*100 -> 12.796321100519403
A24: 茶 叶 | B24: Tea | C24: 1.78 | D24: 4.4800000000000004 | G24: 7.94 | H24: 20.73 | I24: 36.58 | J24: 4.9180327868852736 | K24: 5.7256990679094732 | L24: 13.30 | M24: 9.0312970000000004 | N24: =((I24/C24)^(1/(2015-1978))-1)*100 -> 8.5129878165615569 | O24: =((I24/D24)^(1/(2015-1990))-1)*100 -> 8.762361214503267 | P24: =((I24/G24)^(1/(2015-2000))-1)*100 -> 10.720544592308713 | Q24: =((I24/H24)^(1/(2015-2010))-1)*100 -> 12.028592544634931
A25: 猪、牛、羊肉 | B25: Pork,Beef and Mutton | C25: 29.23 | D25: 74.739999999999995 | G25: 191.51 | H25: 474.82 | I25: 627.03289999999993 | J25: 9.3649400058530841 | K25: 6.1879678403105043 | L25: 75.30 | M25: -0.068529999999999994 | N25: =((I25/C25)^(1/(2015-1978))-1)*100 -> 8.6389216881603161 | O25: =((I25/D25)^(1/(2015-1990))-1)*100 -> 8.8803452738800193 | P25: =((I25/G25)^(1/(2015-2000))-1)*100 -> 8.2280727293483338 | Q25: =((I25/H25)^(1/(2015-2010))-1)*100 -> 5.7188097635377133
A26: 水产品 | B26: Aquatic Products | C26: 1.1200000000000001 | D26: 4.5999999999999996 | G26: 16.62 | H26: 48.17 | I26: 93.737399999999994 | J26: 4.3083900226757343 | K26: 7.0186735350933782 | L26: 11.90 | M26: 7.734343 | N26: =((I26/C26)^(1/(2015-1978))-1)*100 -> 12.710590865973103 | O26: =((I26/D26)^(1/(2015-1990))-1)*100 -> 12.814832485026884 | P26: =((I26/G26)^(1/(2015-2000))-1)*100 -> 12.223926282664133 | Q26: =((I26/H26)^(1/(2015-2010))-1)*100 -> 14.242382435153456
A27: 主要工业产品产量 (万吨) | B27: Output of Major Industrial Products (10 000 tons)
A28: 原 煤 | B28: Raw Coal | C28: 1483 | D28: 2227 | G28: 2216 | H28: 9763.3799999999992 | I28: 4590.1400000000003 | J28: 2.1091242549289291 | K28: -16.805261992093502 | L28: 9.40 | M28: 14.40 | N28: =((I28/C28)^(1/(2015-1978))-1)*100 -> 3.1007325009405173 | O28: =((I28/D28)^(1/(2015-1990))-1)*100 -> 2.9352748763106673 | P28: =((I28/G28)^(1/(2015-2000))-1)*100 -> 4.9744831539143108 | Q28: =((I28/H28)^(1/(2015-2010))-1)*100 -> -14.01055462382892
A29: 粗 钢 | B29: Steel | C29: 35.119999999999997 | D29: 80.150000000000006 | G29: 189.41 | H29: 1293.77 | I29: 1418.08 | J29: 10.980337856549438 | K29: 5.9814234556848644 | L29: 23.30 | M29: -16 | N29: =((I29/C29)^(1/(2015-1978))-1)*100 -> 10.511979328158038 | O29: =((I29/D29)^(1/(2015-1990))-1)*100 -> 12.179083679953685 | P29: =((I29/G29)^(1/(2015-2000))-1)*100 -> 14.36325872190487 | Q29: =((I29/H29)^(1/(2015-2010))-1)*100 -> 1.8518052814826325
A30: 成品钢材 | B30: Steel Products | C30: 25.59 | D30: 68.97 | G30: 183.71 | H30: 1214.99 | I30: 1695.37 | J30: 11.511721907841555 | K30: 0.93401461458162416 | L30: 24.80 | M30: -12.40 | N30: =((I30/C30)^(1/(2015-1978))-1)*100 -> 12.000887765608702 | O30: =((I30/D30)^(1/(2015-1990))-1)*100 -> 13.664323302232795 | P30: =((I30/G30)^(1/(2015-2000))-1)*100 -> 15.969053634927445 | Q30: =((I30/H30)^(1/(2015-2010))-1)*100 -> 6.8903152896562236
A31: 发电量 (亿千瓦小时) | B31: Electricity (100 million kwh) | C31: 52.51 | D31: 125.78 | G31: 317.45999999999998 | H31: 1364.85 | I31: 2352.40 | J31: 10.217315106905001 | K31: 6.4587525150905378 | L31: 16.30 | M31: 0.20 | N31: =((I31/C31)^(1/(2015-1978))-1)*100 -> 10.822743186105743 | O31: =((I31/D31)^(1/(2015-1990))-1)*100 -> 12.42838785139455 | P31: =((I31/G31)^(1/(2015-2000))-1)*100 -> 14.284713505897017 | Q31: =((I31/H31)^(1/(2015-2010))-1)*100 -> 11.502665474026518
A32: 水 泥 | B32: Cement | C32: 131 | D32: 471 | G32: 1642.80 | H32: 5786.16 | I32: 9305.31 | J32: 4.1068034127580422 | K32: 1.234309236675557 | L32: 14.70 | M32: -1.97 | N32: =((I32/C32)^(1/(2015-1978))-1)*100 -> 12.21203727371789 | O32: =((I32/D32)^(1/(2015-1990))-1)*100 -> 12.675215548433449 | P32: =((I32/G32)^(1/(2015-2000))-1)*100 -> 12.25604663891453 | Q32: =((I32/H32)^(1/(2015-2010))-1)*100 -> 9.9684443569150396
A33: 卷 烟 (亿支) | B33: Cigarettes(100 million pieces) | C33: 315 | D33: 2240 | G33: 3063.85 | H33: 3573.78 | I33: 3903.63 | J33: 9.9656357388316241 | K33: 1.4570260112257039 | L33: 3.40 | M33: 1.40 | N33: =((I33/C33)^(1/(2015-1978))-1)*100 -> 7.0396827718895771 | O33: =((I33/D33)^(1/(2015-1990))-1)*100 -> 2.2465881798713561 | P33: =((I33/G33)^(1/(2015-2000))-1)*100 -> 1.6280072380298938 | Q33: =((I33/H33)^(1/(2015-2010))-1)*100 -> 1.781340541882237
A34: 布 (万米) | B34: Cloth (10 000 m) | C34: 10507 | D34: 17974 | G34: 5855 | H34: 412.76 | I34: 118 | J34: 0.4134078212290504 | K34: -4.0163934426229453 | L34: 13.10 | M34: -24.358000000000001 | N34: =((I34/C34)^(1/(2015-1978))-1)*100 -> -11.42560458807389 | O34: =((I34/D34)^(1/(2015-1990))-1)*100 -> -18.212018364906314 | P34: =((I34/G34)^(1/(2015-2000))-1)*100 -> -22.917284243583357 | Q34: =((I34/H34)^(1/(2015-2010))-1)*100 -> -22.153896252045602
A35: 机制纸及纸板 | B35: Machine-made Paper and Paperboards | C35: 5.12 | D35: 15.43 | G35: 22.32 | H35: 44.87 | I35: 58.89 | J35: 1.3797634691195659 | K35: -6.6108786610878596 | L35: -2.5 | M35: 26.427 | N35: =((I35/C35)^(1/(2015-1978))-1)*100 -> 6.8241639470844939 | O35: =((I35/D35)^(1/(2015-1990))-1)*100 -> 5.5035383494811851 | P35: =((I35/G35)^(1/(2015-2000))-1)*100 -> 6.6816746015165407 | Q35: =((I35/H35)^(1/(2015-2010))-1)*100 -> 5.588615889249704
A36: 成品糖 | B36: Sugar of Finished Product | C36: 14 | D36: 51 | G36: 152.25 | H36: 179.78 | I36: 249.58 | J36: 9.9374865272688027 | K36: -6.3192222495692896 | L36: -19.70 | M36: -0.049951000000000002 | N36: =((I36/C36)^(1/(2015-1978))-1)*100 -> 8.0968454109221266 | O36: =((I36/D36)^(1/(2015-1990))-1)*100 -> 6.5578831096817058 | P36: =((I36/G36)^(1/(2015-2000))-1)*100 -> 3.3499248741848175 | Q36: =((I36/H36)^(1/(2015-2010))-1)*100 -> 6.7809255413313174
A37: 交通运输 | B37: Transportation
A38: 货运周转量 (亿吨公里) | B38: Freight Traffic(100 million ton-km) | C38: 62.34 | D38: 260.67 | G38: 479.52 | H38: 915.04 | I38: 1463.67 | J38: 15.745304382576265 | K38: 8.2218059536437238 | L38: 8.8000000000000007 | M38: 3.9811598218281765 | N38: =((I38/C38)^(1/(2015-1978))-1)*100 -> 8.9043700938614698 | O38: =((I38/D38)^(1/(2015-1990))-1)*100 -> 7.1455367445797613 | P38: =((I38/G38)^(1/(2015-2000))-1)*100 -> 7.7231628950675146 | Q38: =((I38/H38)^(1/(2015-2010))-1)*100 -> 9.8501409353759719
A39: 旅客周转量 (亿人公里) | B39: Passenger Traffic(100 million passenger-km) | C39: 24.25 | D39: 87.67 | G39: 237.94 | H39: 523.64 | I39: 599.51 | J39: -6.7439634081480682 | K39: -0.021009286104467506 | L39: 16.80 | M39: 4.5116189878493103 | N39: =((I39/C39)^(1/(2015-1978))-1)*100 -> 9.0563448052583428 | O39: =((I39/D39)^(1/(2015-1990))-1)*100 -> 7.9935498316748399 | P39: =((I39/G39)^(1/(2015-2000))-1)*100 -> 6.3543517819657502 | Q39: =((I39/H39)^(1/(2015-2010))-1)*100 -> 2.743113774566952
A40: 邮电业务总量 (亿元) | B40: Total Post and Telecommunication Services(10 000 yuan) | C40: 0.30 | D40: 1.27 | G40: 85.64 | H40: 268.94 | I40: 791.55 | J40: 15.454545454545453 | K40: 39.79758406790728 | L40: -59.90 | M40: 39.546568000000001 | N40: =((I40/C40)^(1/(2015-1978))-1)*100 -> 23.728318494132061 | O40: =((I40/D40)^(1/(2015-1990))-1)*100 -> 29.356121410853952 | P40: =((I40/G40)^(1/(2015-2000))-1)*100 -> 15.980981487959056 | Q40: =((I40/H40)^(1/(2015-2010))-1)*100 -> 24.097945194322268
A41: 居民消费价格(CPI)总指数(%) | B41: Consumer Price Index(%) | C41: 100.20 | D41: 102.80 | G41: 97.90 | H41: 103.70 | I41: 101.90 | J41: 2.80 | K41: -2.10 | L41: 3.70 | M41: 1.90 | N41: 5.20 | O41: 4.9000000000000004 | P41: 2.70 | Q41: 3
A42: 国有单位职工平均工资(元) | B42: Average Wages of Staff and Workers of State-owned Entities(yuan) | C42: 629 | D42: 2200 | G42: 9422 | H42: 34330 | I42: 64463 | J42: 13.636363636363647 | K42: 11.516155758077872 | L42: 13.20 | M42: 18.567617229238301 | N42: =((I42/C42)^(1/(2015-1978))-1)*100 -> 13.329287554958391 | O42: =((I42/D42)^(1/(2015-1990))-1)*100 -> 14.465738163768037 | P42: =((I42/G42)^(1/(2015-2000))-1)*100 -> 13.678367328237151 | Q42: =((I42/H42)^(1/(2015-2010))-1)*100 -> 13.429845858050605
A43: 教 育 (万人) | B43: Education (10 000 persons)
A44: 高等学校在校学生数 | B44: Student Enrollment of Regular Institutions of Higher Education | C44: 1.59 | D44: 4.3499999999999996 | G44: 9.0399999999999991 | H44: 43.69 | I44: 61.46 | J44: -3.5476718403547713 | K44: 22.327469553450598 | L44: 12.20 | M44: 6.516464 | N44: =((I44/C44)^(1/(2015-1978))-1)*100 -> 10.381724255298842 | O44: =((I44/D44)^(1/(2015-1990))-1)*100 -> 11.174230455472589 | P44: =((I44/G44)^(1/(2015-2000))-1)*100 -> 13.630506284674858 | Q44: =((I44/H44)^(1/(2015-2010))-1)*100 -> 7.0636640595849398
A45: 中等专业学校在校学生数 | B45: Student Enrollment of Specialized Secondary Schools | C45: 2.66 | D45: 7.38 | G45: 11.92 | H45: 29 | I45: 30.97 | J45: 2.7855153203342642 | K45: -0.25104602510459539 | L45: 24.10 | M45: 0.42153000000000002 | N45: =((I45/C45)^(1/(2015-1978))-1)*100 -> 6.8593235816758913 | O45: =((I45/D45)^(1/(2015-1990))-1)*100 -> 5.9047388764041253 | P45: =((I45/G45)^(1/(2015-2000))-1)*100 -> 6.5722978777088326 | Q45: =((I45/H45)^(1/(2015-2010))-1)*100 -> 1.3231403257230046
A46: 普通中学在校学生数 | B46: Student Enrollment of Regular Secondary Schools | C46: 128.54 | D46: 123.95 | G46: 185.97 | H46: 270.63 | I46: 267.60000000000002 | J46: 3.6978164477537101 | K46: 11.066650740563787 | L46: 2.10 | M46: 0.39392199999999999 | N46: =((I46/C46)^(1/(2015-1978))-1)*100 -> 2.001532708594822 | O46: =((I46/D46)^(1/(2015-1990))-1)*100 -> 3.1263348714434924 | P46: =((I46/G46)^(1/(2015-2000))-1)*100 -> 2.4557211550161329 | Q46: =((I46/H46)^(1/(2015-2010))-1)*100 -> -0.224931570612108
A47: 小学在校学生数 | B47: Student Enrollment of Primary Schools | C47: 436.03 | D47: 446.86 | G47: 472.06 | H47: 435.21 | I47: 377.78 | J47: -2.3086004110008274 | K47: -1.8178036605657311 | L47: -2 | M47: -1.283023 | N47: =((I47/C47)^(1/(2015-1978))-1)*100 -> -0.38681488963346888 | O47: =((I47/D47)^(1/(2015-1990))-1)*100 -> -0.66948223835160414 | P47: =((I47/G47)^(1/(2015-2000))-1)*100 -> -1.4743177904501859 | Q47: =((I47/H47)^(1/(2015-2010))-1)*100 -> -2.7906544512840137
A48: 卫 生 | B48: Health Care
A49: 医院病床数(万张) | B49: Number of Hospital Sickbeds (10 000) | C49: 5.41 | D49: 7.61 | G49: 6.61 | H49: 11.25 | I49: 18.13 | J49: 1.4666666666666606 | K49: 2.3615950445218914 | L49: 12.80 | M49: 6.8355922215674729 | N49: =((I49/C49)^(1/(2015-1978))-1)*100 -> 3.3224294141869004 | O49: =((I49/D49)^(1/(2015-1990))-1)*100 -> 3.5334118175664564 | P49: =((I49/G49)^(1/(2015-2000))-1)*100 -> 6.9579547220152804 | Q49: =((I49/H49)^(1/(2015-2010))-1)*100 -> 10.014278862757543
A50: 专业卫生技术人员(万人) | B50: Number of Medical Technical Personnel (10 000 persons) | C50: 6.55 | D50: 10.16 | G50: 12.41 | H50: 14.17 | I50: 22.80 | J50: -89.745867059607193 | K50: 2.5280898876404612 | L50: 5.90 | M50: 9.1431310000000003 | N50: =((I50/C50)^(1/(2015-1978))-1)*100 -> 3.4285333127674011 | O50: =((I50/D50)^(1/(2015-1990))-1)*100 -> 3.2860444531822353 | P50: =((I50/G50)^(1/(2015-2000))-1)*100 -> 4.1383928582710672 | Q50: =((I50/H50)^(1/(2015-2010))-1)*100 -> 9.979818682720488
A51: #医 生 | B51: Number of Doctors | C51: 3.11 | D51: 5.39 | G51: 6.26 | H51: 6.21 | I51: 7.96 | J51: 3.8175584575677046 | K51: 3.1641397495056012 | L51: 4.5 | M51: 5.570291777188328 | N51: =((I51/C51)^(1/(2015-1978))-1)*100 -> 2.5725502529266864 | O51: =((I51/D51)^(1/(2015-1990))-1)*100 -> 1.5717586626105007 | P51: =((I51/G51)^(1/(2015-2000))-1)*100 -> 1.614554073249086 | Q51: =((I51/H51)^(1/(2015-2010))-1)*100 -> 5.0907020973662176
A54: 注：2002年进出口总额因口径与1995年以前不一致,故不可比。 | G54: Note: The total Value of import and export in 2002 can not be compared with those before 1995 because of the different accounting approaches.

A1: Oil-bearing Crops