B2: 36821 | C2: 4946735 | D2: 116615 | E2: 4565123 | F2: 167210 | G2: 97787 | I2: =C2/10 -> 494673.5 | J2: =D2/10 -> 11661.5 | K2: =E2/10 -> 456512.3 | L2: =F2/10 -> 16721 | M2: =G2/10 -> 9778.7
I3: =C3/10 -> 0 | J3: =D3/10 -> 0 | K3: =E3/10 -> 0 | L3: =F3/10 -> 0 | M3: =G3/10 -> 0
B4: 20242 | C4: 2652260 | D4: 93597 | E4: 2401905 | F4: 99166 | G4: 57592 | I4: =C4/10 -> 265226 | J4: =D4/10 -> 9359.7 | K4: =E4/10 -> 240190.5 | L4: =F4/10 -> 9916.6 | M4: =G4/10 -> 5759.2
B5: 1832 | C5: 155256 | D5: 16531 | E5: 136259 | F5: 1588 | G5: 878 | I5: =C5/10 -> 15525.6 | J5: =D5/10 -> 1653.1 | K5: =E5/10 -> 13625.9 | L5: =F5/10 -> 158.8 | M5: =G5/10 -> 87.8
B6: 203 | C6: 21652 | D6: 4421 | E6: 16987 | F6: 192 | G6: 52 | I6: =C6/10 -> 2165.2 | J6: =D6/10 -> 442.1 | K6: =E6/10 -> 1698.7 | L6: =F6/10 -> 19.2 | M6: =G6/10 -> 5.2
B7: 146 | C7: 7102 | D7: 0 | E7: 6887 | F7: 215 | G7: 0 | I7: =C7/10 -> 710.2 | J7: =D7/10 -> 0 | K7: =E7/10 -> 688.7 | L7: =F7/10 -> 21.5 | M7: =G7/10 -> 0
B8: 5380 | C8: 866042 | D8: 24260 | E8: 745778 | F8: 83581 | G8: 12423 | I8: =C8/10 -> 86604.2 | J8: =D8/10 -> 2426 | K8: =E8/10 -> 74577.8 | L8: =F8/10 -> 8358.1 | M8: =G8/10 -> 1242.3
B9: 5350 | C9: 863458 | D9: 22202 | E9: 745316 | F9: 83550 | G9: 12390 | I9: =C9/10 -> 86345.8 | J9: =D9/10 -> 2220.2 | K9: =E9/10 -> 74531.6 | L9: =F9/10 -> 8355 | M9: =G9/10 -> 1239
B10: 25 | C10: 10533 | D10: 0 | E10: 10533 | F10: 0 | G10: 0 | I10: =C10/10 -> 1053.3 | J10: =D10/10 -> 0 | K10: =E10/10 -> 1053.3 | L10: =F10/10 -> 0 | M10: =G10/10 -> 0
B11: 10523 | C11: 1316763 | D11: 40970 | E11: 1228340 | F11: 10578 | G11: 36875 | I11: =C11/10 -> 131676.3 | J11: =D11/10 -> 4097 | K11: =E11/10 -> 122834 | L11: =F11/10 -> 1057.8 | M11: =G11/10 -> 3687.5
B12: 2487 | C12: 198951 | D12: 3654 | E12: 189786 | F12: 3224 | G12: 2287 | I12: =C12/10 -> 19895.1 | J12: =D12/10 -> 365.4 | K12: =E12/10 -> 18978.6 | L12: =F12/10 -> 322.4 | M12: =G12/10 -> 228.7
B13: 7405 | C13: 1066672 | D13: 32589 | E13: 993701 | F13: 7354 | G13: 33028 | I13: =C13/10 -> 106667.2 | J13: =D13/10 -> 3258.9 | K13: =E13/10 -> 99370.1 | L13: =F13/10 -> 735.4 | M13: =G13/10 -> 3302.8
B14: 604 | C14: 49040 | D14: 4427 | E14: 43053 | F14: 0 | G14: 1560 | I14: =C14/10 -> 4904 | J14: =D14/10 -> 442.7 | K14: =E14/10 -> 4305.3 | L14: =F14/10 -> 0 | M14: =G14/10 -> 156
B15: 2133 | C15: 274912 | D15: 7415 | E15: 257121 | F15: 3012 | G15: 7364 | I15: =C15/10 -> 27491.2 | J15: =D15/10 -> 741.5 | K15: =E15/10 -> 25712.1 | L15: =F15/10 -> 301.2 | M15: =G15/10 -> 736.4
B16: 1115 | C16: 283802 | D16: 0 | E16: 243478 | F16: 25651 | G16: 14673 | I16: =C16/10 -> 28380.2 | J16: =D16/10 -> 0 | K16: =E16/10 -> 24347.8 | L16: =F16/10 -> 2565.1 | M16: =G16/10 -> 1467.3
B17: 187 | C17: 59887 | D17: 0 | E17: 35892 | F17: 23995 | G17: 0 | I17: =C17/10 -> 5988.7 | J17: =D17/10 -> 0 | K17: =E17/10 -> 3589.2 | L17: =F17/10 -> 2399.5 | M17: =G17/10 -> 0
B18: 928 | C18: 223915 | D18: 0 | E18: 207586 | F18: 1656 | G18: 14673 | I18: =C18/10 -> 22391.5 | J18: =D18/10 -> 0 | K18: =E18/10 -> 20758.6 | L18: =F18/10 -> 165.6 | M18: =G18/10 -> 1467.3
B19: 4381 | C19: 508653 | D19: 0 | E19: 492831 | F19: 0 | G19: 15822 | I19: =C19/10 -> 50865.3 | J19: =D19/10 -> 0 | K19: =E19/10 -> 49283.1 | L19: =F19/10 -> 0 | M19: =G19/10 -> 1582.2
C20: 90506 | D20: 0 | E20: 74684 | F20: 0 | G20: 15822 | I20: =C20/10 -> 9050.6 | J20: =D20/10 -> 0 | K20: =E20/10 -> 7468.4 | L20: =F20/10 -> 0 | M20: =G20/10 -> 1582.2
B21: 3828 | C21: 418147 | D21: 0 | E21: 418147 | F21: 0 | G21: 0 | I21: =C21/10 -> 41814.7 | J21: =D21/10 -> 0 | K21: =E21/10 -> 41814.7 | L21: =F21/10 -> 0 | M21: =G21/10 -> 0
I22: =C22/10 -> 0 | J22: =D22/10 -> 0 | K22: =E22/10 -> 0 | L22: =F22/10 -> 0 | M22: =G22/10 -> 0
B23: 30867 | C23: 4184483 | D23: 116615 | E23: 3839545 | F23: 161031 | G23: 67292 | I23: =C23/10 -> 418448.3 | J23: =D23/10 -> 11661.5 | K23: =E23/10 -> 383954.5 | L23: =F23/10 -> 16103.1 | M23: =G23/10 -> 6729.2
B24: 5087 | C24: 627162 | D24: 0 | E24: 610276 | F24: 2213 | G24: 14673 | I24: =C24/10 -> 62716.2 | J24: =D24/10 -> 0 | K24: =E24/10 -> 61027.6 | L24: =F24/10 -> 221.3 | M24: =G24/10 -> 1467.3
B25: 103 | C25: 9873 | D25: 0 | E25: 9873 | F25: 0 | G25: 0 | I25: =C25/10 -> 987.3 | J25: =D25/10 -> 0 | K25: =E25/10 -> 987.3 | L25: =F25/10 -> 0 | M25: =G25/10 -> 0
B26: 764 | C26: 125217 | D26: 0 | E26: 105429 | F26: 3966 | G26: 15822 | I26: =C26/10 -> 12521.7 | J26: =D26/10 -> 0 | K26: =E26/10 -> 10542.9 | L26: =F26/10 -> 396.6 | M26: =G26/10 -> 1582.2

A1: 553