A1: 8-12 全省能源消费弹性系数(1980-2015年)
A2: Elasticity Ratio of Energy Production at Current Year (1980-2015)
A5: 年 份 | B5: 当年能源消费 | C5: 当年电力消费 | D5: 当年生产总值 | E5: 当年能源消费 | F5: 当年电力消费
B6: 增长(％) | C6: 增长(％) | D6: 增长(％) | E6: 弹性系数 | F6: 弹性系数
B7: Growth Rate of | C7: Growth Rate of | D7: Growth Rate of | E7: Elasticity Ratio of | F7: Elasticity Ratio of
A8: Year | B8: Energy Consumption | C8: Electricity Consumption | D8: Gross Regional Product | E8: Energy Consumption | F8: Electricity Consumption
B9: at Current Year | C9: at Current Year | D9: at Current Year | E9: at Current Year | F9: at Current Year
B10: (%) | C10: (%) | D10: of Yunnan Province (%)
A12: 1980 | B12: -11.76 | C12: 5.07 | D12: 8.5 | E12: -1.38 | F12: 0.60
A14: 1981 | B14: 0.24310326603953492 | C14: 3.4231200897867575 | D14: 7.7954898911352988 | E14: 0.031185117219635121 | F14: 0.43911545490930404
A15: 1982 | B15: 7.6128215942640187 | C15: 4.4673539518900407 | D15: 15.491433724075732 | E15: 0.49142137066582092 | F15: 0.28837575859406628
A16: 1983 | B16: 7.2604350382128091 | C16: -0.20775623268697308 | D16: 8.4009993753903842 | E16: 0.86423468373075862 | F16: -0.024729942641772772
A17: 1984 | B17: 12.021558417831368 | C17: 13.150589868147122 | D17: 14.505906078939779 | E17: 0.82873543730472099 | F17: 0.90656797283691537
A18: 1985 | B18: 5.8737666150207923 | C18: 9.0463048144741052 | D18: 12.995345326456164 | E18: 0.45199003700677887 | F18: 0.69611884772753752
A20: 1986 | C20: 17.688413948256464 | D20: 4.2974838566020912 | E20: 1.8055212337538937 | F20: 4.115993110964757
A21: 1987 | B21: 9.589227129450272 | C21: 4.4444444444444509 | D21: 12.297181895815545 | E21: 0.77979062281849076 | F21: 0.36141975308642021
A22: 1988 | B22: 5.8236533331593954 | C22: 20.796156485929984 | D22: 15.998098859315579 | E22: 0.36402158683800878 | F22: 1.299914237860865
A23: 1989 | B23: 5.1987032517318621 | C23: 4.7443181818181968 | D23: 5.8018520036056564 | E23: 0.89604203080344735 | F23: 0.81772478492553102
A24: 1990 | B24: 14.489094072776499 | C24: 12.602838803001525 | D24: 8.6980094493068094 | E24: 1.6657942437543813 | F24: 1.4489336757395581
A26: 1991 | B26: 0.39607405663757422 | C26: 13.263749498193489 | D26: 6.5982613652558086 | E26: 0.060027033594510969 | F26: 2.0101885578579632
A27: 1992 | B27: 2.7875754363072769 | C27: 9.7894662224427655 | D27: 10.902406417112287 | E27: 0.25568441770175909 | F27: 0.89791793186844848
A28: 1993 | B28: 3.6293581803125141 | C28: 26.982179752066116 | D28: 11.102404918329212 | E28: 0.32689837985648718 | F28: 2.4303004574730132
A29: 1994 | B29: 9.2353335247391968 | C29: -0.57965119235267037 | D29: 12.200943959203592 | E29: 0.75693598426641961 | F29: -0.047508716890336956
A30: 1995 | B30: 15.671543718240756 | C30: 14.412110673553924 | D30: 11.700996035199696 | E30: 1.3393341619035337 | F30: 1.2316994750018271
A32: 1996 | B32: 6.7743462536213883 | C32: 12.820168968754174 | D32: 11.098606181283021 | E32: 0.61037810901388889 | F32: 1.1551152243219911
A33: 1997 | B33: 21.619618149767874 | C33: 4.5604025516066349 | D33: 9.7015506896283021 | E33: 2.2284703591644268 | F33: 0.47006944533950157
A34: 1998 | B34: -1.880734212506352 | C34: 2.4365289882531282 | D34: 8.1012927972723414 | E34: -0.23215235636707074 | F34: 0.30075804556446761
A35: 1999 | B35: -2.2743417278695999 | C35: 9.7547442015314623 | D35: 7.300325262016627 | E35: -0.31153978024827628 | F35: 1.3362067923582943
A36: 2000 | B36: 5.4854515095940748 | C36: 6.9261880687563337 | D36: 7.4986986741786277 | E36: 0.73152046080781152 | F36: 0.92365200546146708
A38: 2001 | B38: 7.8625736305368843 | C38: 9.399527186761226 | D38: 6.7990201663438388 | E38: 1.1564274613359427 | F38: 1.3824826161408204
A39: 2002 | B39: 10.432421017741111 | C39: 13.366179733195027 | D39: 9.0012001600213267 | E39: 1.1590033364746768 | F39: 1.4849330639885869
A40: 2003 | B40: 7.7132919098300556 | C40: 4.1503583591724791 | D40: 8.801076584291657 | E40: 0.87640322589589759 | F40: 0.47157393978142675
A41: 2004 | B41: 17.075171293289614 | C41: 15.959393835867154 | D41: 11.300514988643261 | E41: 1.5110082425844964 | F41: 1.4122713745263777
A42: 2005 | B42: 15.627441307840396 | C42: 17.268881920915845 | D42: 8.90 | E42: 1.7364915249385622 | F42: 1.940323811338859
A44: 2006 | B44: 9.9036873077777301 | C44: 15.858232391206828 | D44: 11.60 | E44: 0.85376614722221811 | F44: 1.3670889992419679
A45: 2007 | B45: 7.7344926995727148 | C45: 15.473640565265455 | D45: 12.20 | E45: 0.63397481144038648 | F45: 1.2683311938742177
A46: 2008 | B46: 5.3022193969632925 | C46: 11.256656621980055 | D46: 10.60 | E46: 0.50020937707200874 | F46: 1.0619487379226467
A47: 2009 | B47: 6.9398756940317163 | C47: 7.4442793158749021 | D47: 12.10 | E47: 0.57354344578774519 | F47: 0.61522969552685147
A48: 2010 | B48: 7.9943159377262845 | C48: 22.036680018604898 | D48: 12.30 | E48: =B48/D48 -> 0.64994438518099873 | F48: =C48/D48 -> 1.7916000015125932
A50: 2011 | B50: 9.98 | C50: 19.899999999999999 | D50: 13.70 | E50: =B50/D50 -> 0.7284671532846716 | F50: =C50/D50 -> 1.4525547445255473
A51: 2012 | B51: 9.3644932622774633 | C51: 9.2799999999999994 | D51: 13 | E51: 0.72034563555980491 | F51: 0.7138461538461538
A52: 2013 | B52: 8.4700000000000006 | C52: 10.939 | D52: 12.06 | E52: 0.70199999999999996 | F52: 0.90700000000000003
A53: 2014 | B53: 3.80 | C53: 4.7659970627579318 | D53: 8.10 | E53: 0.46913580246913578 | F53: 0.58839469910591757
A54: 2015 | B54: -0.94 | C54: -5.9353808738428544 | D54: 8.6999999999999993 | E54: =B54/D54 -> -0.10804597701149425 | F54: =C54/D54 -> -0.682227686648604
A56: 注: 2005至2008年数据根据云南省第二次全国经济普查数据修正；2013至2014年数据根据云南省第三次全国经济普查数据修正。
A57: Note: Data from year 2005 to 2008 are regulated according to that of the second national economic census.
A58: Data from 2013 to 2014 have been adjusted according to the third national economic census.

A1: 7.7591983548096488