A1: ########## | B1: =ROUND(A1/10000,2) -> 38.56
A2: ########## | B2: =ROUND(A2/10000,2) -> 39.58
A3: ########## | B3: =ROUND(A3/10000,2) -> 25.45
A4: ########## | B4: =ROUND(A4/10000,2) -> 65.01
A5: ########## | B5: =ROUND(A5/10000,2) -> 29.54
A6: ########## | B6: =ROUND(A6/10000,2) -> 47.02
A7: ########## | B7: =ROUND(A7/10000,2) -> 56.38
A8: ########## | B8: =ROUND(A8/10000,2) -> 27.66
A9: ########## | B9: =ROUND(A9/10000,2) -> 41.1
A10: ########## | B10: =ROUND(A10/10000,2) -> 37.47
A11: ########## | B11: =ROUND(A11/10000,2) -> 32.36
A12: ########## | B12: =ROUND(A12/10000,2) -> 42.65
A13: ########## | B13: =ROUND(A13/10000,2) -> 39.97
A14: ########## | B14: =ROUND(A14/10000,2) -> 42.18
A15: ########## | B15: =ROUND(A15/10000,2) -> 21.54
A16: ########## | B16: =ROUND(A16/10000,2) -> 17.75
A17: ########## | B17: =ROUND(A17/10000,2) -> 43.27