A1: 1-6 云南省国民经济主要数据占全国的比重(2015年)
A2: Proportion of Principal Indicators of National Economy of Yunnan
A3: Province to the Whole Country (2015)
A5: 单位: % | E5: (%)
A6: 指 标 | B6: Item | E6: 云南占全国
C7: 全 国 | D7: 云 南 | E7: 的比重(%)
E8: Proportion
C9: China | D9: Yunnan | E9: of Yunnan
E10: to National
E11: Total(%)
A13: 生产总值(GDP)(亿元) | B13: Gross Regional Product (100 million yuan) | C13: 676707.80 | D13: 13619.17 | E13: =D13/C13*100 -> 2.0125628816455197
A14: 第一产业 | B14: Primary Industry | C14: 60863 | D14: 2055.7800000000002 | E14: =D14/C14*100 -> 3.3777171680659843
A15: 第二产业 | B15: Secondary Industry | C15: 274277.80 | D15: 5416.12 | E15: =D15/C15*100 -> 1.9746840611963492
A16: 第三产业 | B16: Tertiary Industry | C16: 341566.90 | D16: 6147.27 | E16: =D16/C16*100 -> 1.799726495746514
A17: 人均生产总值(元/人) | B17: Per Capita Gross Regional Product(yuan/person) | C17: 49351 | D17: 28806 | E17: =D17/C17*100 -> 58.369637899941239
A18: 年末总人口(万人) | B18: Total Population at the Year-end (10 000 persons) | C18: 137462 | D18: 4741.80 | E18: =D18/C18*100 -> 3.4495351442580495
A19: 城镇化率(%) | B19: Urbanization Rate(%) | C19: 56.10 | D19: 43.329537000000002 | E19: =D19/C19*100 -> 77.236251336898391
A20: 全部职工平均工资(元) | B20: Average Wages of All Staff and Workers (yuan) | C20: 63241 | D20: 55025 | E20: =D20/C20*100 -> 87.008428076722382
A21: 城镇常住居民人均可支配收入(元) | B21: Annual Average Disposable Income of Urban Households (yuan) | C21: 31195 | D21: 26373 | E21: =D21/C21*100 -> 84.542394614521555
A22: 农村居民年人均纯收入(元) | B22: Rural Per Capita Net Income (yuan) | C22: 11422 | D22: 8242 | E22: =D22/C22*100 -> 72.158991420066542
A23: 全社会固定资产投资额(亿元) | B23: Total Investment in Fixed Assets of the whole Province (100 million yuan) | C23: 561999.80000000005 | D23: 13500.62 | E23: =D23/C23*100 -> 2.4022464064933828
A24: 社会消费品零售总额(亿元) | B24: Total Retail Sales of Consumer Goods (100 million yuan) | C24: 300930.80 | D24: 5103.1508000000003 | E24: =D24/C24*100 -> 1.6957887992854173
A25: 对外贸易进出口总额 (亿美元) | B25: Total Value of Export and Import in Foreign Trade(USD 100 million) | C25: 39569 | D25: 245.27 | E25: =D25/C25*100 -> 0.61985392605322354
A26: #出口总额 | B26: Total Export Value | C26: 22749.5 | D26: 166.26 | E26: =D26/C26*100 -> 0.73082924899448343
A27: 实际利用外商直接投资(亿美元) | B27: Actually Utilized Direct Foreign Investment (USD 100 million) | C27: 1262.67 | D27: 22.58 | E27: =D27/C27*100 -> 1.7882740541867628
A28: 工农业主要产品产量(万吨) | B28: Output of Major Industrial and Farm Products (10 000 tons)
A29: 粮 食 | B29: Grain | C29: 62143.90 | D29: 1969.79 | E29: =D29/C29*100 -> 3.1697238184278747
A30: 烤 烟 | B30: Flue-cured Tobacco | C30: 260.64 | D30: 90.34 | E30: =D30/C30*100 -> 34.66083486801719
A31: 油 料 | B31: Oil-bearing Crops | C31: 3537 | D31: 65.92 | E31: =D31/C31*100 -> 1.8637263217415889
A32: 猪、牛、羊肉 | B32: Pork , Beef and Mutton | C32: 6627.5 | D32: 627.03289999999993 | E32: =D32/C32*100 -> 9.4610773293096937
A33: 原 煤(亿吨) | B33: Coal (100 Million tons) | C33: 37.5 | D33: 0.45901399999999998 | E33: =D33/C33*100 -> 1.2240373333333332
A34: 粗 钢 | B34: Steel | C34: 80382.5 | D34: 1418.08 | E34: =D34/C34*100 -> 1.7641650856840729
A35: 钢 材 | B35: Steel Products | C35: 112349.60 | D35: 1695.37 | E35: =D35/C35*100 -> 1.5090129381858057
A36: 发电量(亿千瓦小时) | B36: Electricity (100 million kwh) | C36: 58105.80 | D36: 2352.40 | E36: =D36/C36*100 -> 4.0484770883457415
A37: 水 泥(亿吨) | B37: Cement (100 Million tons) | C37: 23.59 | D37: 0.93 | E37: =D37/C37*100 -> 3.9423484527342096
A38: 农用化肥(折100％) | B38: Chemical Fertilizer | C38: 7432 | D38: 334.41 | E38: =D38/C38*100 -> 4.4995963401507
A39: 成品糖 (万吨) | B39: Sugar of Finished Product (10 000 tons) | C39: 1474.10 | D39: 249.58 | E39: =D39/C39*100 -> 16.931008751102368
A40: 卷 烟(亿支) | B40: Cigarettes (10 billions cigarettes) | C40: 25890.70 | D40: 3903.63 | E40: =D40/C40*100 -> 15.077344374621001
A41: 普通高等学校在校学生数(万人) | B41: Student Enrollment of Regular Institutions of Higher Education | C41: 2625.30 | D41: 61.46 | E41: =D41/C41*100 -> 2.3410657829581383
B42: (10 000 persons)
A43: 卫生机构病床数(万张) | B43: Number of Hospital Sickbeds (10 000 beds) | C43: 701.5 | D43: 22.49 | E43: =D43/C43*100 -> 3.2059871703492511
A44: 卫生技术人员(万人) | B44: Medical Technical Personnel (10 000 persons) | C44: 800.8 | D44: 20.89 | E44: =D44/C44*100 -> 2.6086413586413588
A45: #医生 | B45: Doctors | C45: 303.9 | D45: 7.54 | E45: =D45/C45*100 -> 2.4810793024021063